product_name,page_url,technical_sheet_url,buy_url,calculator_url,summary_public,finish,recommended_use,surface_targets,benefit_tags,application_methods,related_products,coverage_ranges,drying_times,dilution_hints,presentations,inventory_match_name,inventory_match_ref,inventory_match_score,inventory_match_source,canonical_family_from_inventory,decision,decision_note
Impermeabilizante Permex/Base Agua 13421,https://www.pintuco.com.co/productos/impermeabilizante-permex-base-agua-13421/,https://www.pintuco.com.co/wp-content/uploads/2019/12/ft-Permex-base-agua-13421-1.pdf,https://tienda.pintuco.com/,,"Impermeabilizante Permex/Base Agua 13421 es un recubrimiento impermeabilizante, de textura gruesa y alta cobertura que reduce los efectos de la abrasión y protege de la humedad.",,"Impermeabilizante Permex/Base Agua 13421 es un recubrimiento impermeabilizante, de textura gruesa y alta cobertura que reduce los efectos de la abrasión y protege de la humedad.",,impermeable | alto_cubrimiento,,,,,,1/4 galón | galón,IMPERMEABILIZANTE P7,56253804,87.69,db:vw_inventario_agente,IMPERMEABILIZANTE P7,cuarentena,Falta señal de familia/marca suficientemente fuerte
Barniz Crystal 9400,https://www.pintuco.com.co/productos/barniz-crystal-9400/,https://www.pintuco.com.co/download/51369/?tmstv=1672344804,https://tienda.pintuco.com/,,"Barniz Crystal 9400 es usado como acabado final sobre color en sistemas bicapa de repinte automotriz Pintuco, proporcionando un acabado brillante con muy buena nivelación, que actúa como una capa protectora del sistema ante la degradación ambiental.",,"Barniz Crystal 9400 es usado como acabado final sobre color en sistemas bicapa de repinte automotriz Pintuco, proporcionando un acabado brillante con muy buena nivelación, que actúa como una capa protectora del sistema ante la degradación ambiental.",,,,,,,,,K PROM PG8 LLEV9 1/4 BARNIZ CRYSTAL 9400,10371566,90.0,db:vw_inventario_agente,K PROM PG8 LLEV9 BARNIZ CRYSTAL,cuarentena,Falta señal de familia/marca suficientemente fuerte
Barniz Flash Clear 9410,https://www.pintuco.com.co/productos/barniz-flash-clear-9410/,https://www.pintuco.com.co/download/51367/?tmstv=1672344804,https://tienda.pintuco.com/,,"Barniz Flash Clear 9410 es un barniz de hipercurado con altos sólidos diseñado para reparaciones Express, que presenta una excelente nivelación y retención de brillo.",,"Barniz Flash Clear 9410 es un barniz de hipercurado con altos sólidos diseñado para reparaciones Express, que presenta una excelente nivelación y retención de brillo.",exterior,,,,,,,,F BARNIZ K1 AUT  GL-END E40 1/4 GL THII,F51019803,85.5,db:vw_inventario_agente,F BARNIZ K1 AUT GL END E40 THII,cuarentena,Falta señal de familia/marca suficientemente fuerte
Impermeabilizante Permex Base Solvente 13417,https://www.pintuco.com.co/productos/impermeabilizante-permex-base-solvente-13417/,https://www.pintuco.com.co/wp-content/uploads/2019/12/ft-permex-base-solvente-13417-1.pdf,https://tienda.pintuco.com/,,"Impermeabilizante Permex Base Solvente 13417 es un recubrimiento impermeabilizante, de textura gruesa y alta cobertura que reduce los efectos de la abrasión y protege de la humedad.",,"Impermeabilizante Permex Base Solvente 13417 es un recubrimiento impermeabilizante, de textura gruesa y alta cobertura que reduce los efectos de la abrasión y protege de la humedad.",exterior,impermeable | alto_cubrimiento,,,,,,1/4 galón | galón,IMPERMEABILIZANTE P7,56253804,87.69,db:vw_inventario_agente,IMPERMEABILIZANTE P7,cuarentena,Falta señal de familia/marca suficientemente fuerte
Pintulaca Sistema Nitro de Alto Desempeño/Masilla 1K,https://www.pintuco.com.co/productos/pintulaca-sistema-nitro-de-alto-desempeno-masilla-1k/,,https://tienda.pintuco.com/,,,,,,,,,,,,,AUXILIO DE TRANSPORTE,52052701,85.5,db:vw_inventario_agente,AUXILIO DE TRANSPORTE,cuarentena,La página pública tiene poca densidad técnica; revisar manualmente
Pintulaca Sistema Nitro de Alto Desempeño / Colores Básicos,https://www.pintuco.com.co/productos/pintulaca-sistema-nitro-de-alto-desempeno-colores-basicos/,https://www.pintuco.com.co/download/51385/?tmstv=1672344804,https://tienda.pintuco.com/,,,,,,,,,,,,,AUXILIO DE TRANSPORTE,52052701,85.5,db:vw_inventario_agente,AUXILIO DE TRANSPORTE,cuarentena,La página pública tiene poca densidad técnica; revisar manualmente
Aluminios para Metalizados Pintulaca,https://www.pintuco.com.co/productos/pintulaca-sistema-nitro-de-alto-desempeno-colores-basicos-para-obtener-metalizados/,https://www.pintuco.com.co/download/51383/?tmstv=1672344804,https://tienda.pintuco.com/,,"Lacas nitro de secado al aire que se caracterizan por su excelente acabado y brillo, resistentes a la intemperie, mayor rendimiento con menos manos de aplicación y fácil de aplicar en todo tipo de ambientes.",,"Lacas nitro de secado al aire que se caracterizan por su excelente acabado y brillo, resistentes a la intemperie, mayor rendimiento con menos manos de aplicación y fácil de aplicar en todo tipo de ambientes.",exterior,rapido_secado | durabilidad,,,,,,1/4 galón | galón,"DISCO PARA CONCRETO 7""",56254161,85.5,db:vw_inventario_agente,"DISCO PARA CONCRETO """,cuarentena,Falta señal de familia/marca suficientemente fuerte
Pintura Poliuretano / Single Stage S600,https://www.pintuco.com.co/productos/pintura-poliuretano-single-stage-s600/,https://www.pintuco.com.co/wp-content/uploads/2019/12/ft-poliuretano-serie-600-mate-1.pdf,https://tienda.pintuco.com/,,,,,,,,,,,,,POLIURETANO 2K NEGRO GAL,10014937,85.5,db:vw_inventario_agente,POLIURETANO 2K NEGRO GAL,cuarentena,La página pública tiene poca densidad técnica; revisar manualmente
Masilla Poliéster Duretán 19167,https://www.pintuco.com.co/productos/masilla-poliester-duretan-19167/,https://www.pintuco.com.co/wp-content/uploads/2019/12/FT-Masilla-Duretan-19167.pdf,https://tienda.pintuco.com/,,"Masilla Poliéster Duretán 19167 de dos 2 componentes con muy buen poder de relleno y excelente lijabilidad, secado rápido, muy buen desbaste y tersura que ofrece un excelente acabado que no requiere uso de masilla de rectificación.",,"Masilla Poliéster Duretán 19167 de dos 2 componentes con muy buen poder de relleno y excelente lijabilidad, secado rápido, muy buen desbaste y tersura que ofrece un excelente acabado que no requiere uso de masilla de rectificación.",madera,rapido_secado,,,,,,1/4 galón | galón,MASILLA BOLSA,56254852,85.5,db:vw_inventario_agente,MASILLA BOLSA,cuarentena,Falta señal de familia/marca suficientemente fuerte
Masilla poliéster P2500,https://www.pintuco.com.co/productos/masilla-poliester-p2500/,https://www.pintuco.com.co/wp-content/uploads/2019/12/FT-Masilla-poliester-P2500.pdf,https://tienda.pintuco.com/,,"Masilla poliéster P2500 es un producto de dos (2) componentes con buen poder de relleno y fácil lijabilidad, recomendada para rellenar o nivelar hendiduras e imperfecciones.",,"Masilla poliéster P2500 es un producto de dos (2) componentes con buen poder de relleno y fácil lijabilidad, recomendada para rellenar o nivelar hendiduras e imperfecciones.",madera,,,,,,,1/4 galón | galón,MEG MASILLA POLIESTER P2500 AC 1.1KG,5864066,90.0,db:vw_inventario_agente,MEG MASILLA POLIESTER P2500 AC,cuarentena,Falta señal de familia/marca suficientemente fuerte
Ajustador P502,https://www.pintuco.com.co/productos/ajustador-p502/,https://www.pintuco.com.co/wp-content/uploads/2019/12/ft-thinner-pu-ps-p502-2.pdf,https://tienda.pintuco.com/,,"Ajustador P502 es una mezcla de solventes, formulados con el fin de obtener un excelente poder de dilución con rata de evaporación rápida.",,"Ajustador P502 es una mezcla de solventes, formulados con el fin de obtener un excelente poder de dilución con rata de evaporación rápida.",exterior,impermeable,,ajustador,,,Contiene instrucciones de dilución en la página pública,1/4 galón | galón,AJUSTADOR NM P502 GL,51018875,95.0,db:vw_inventario_agente,AJUSTADOR NM P502 GL,cuarentena,Falta señal de familia/marca suficientemente fuerte
Thinner para Poliuretano y Poliéster Ref. 21106,https://www.pintuco.com.co/productos/thinner-para-poliuretano-y-poliester-ref-21106/,https://www.pintuco.com.co/wp-content/uploads/2019/12/ft-thinner-pu-ps-21106-1.pdf,https://tienda.pintuco.com/,,Thinner para Poliuretano y Poliéster Ref.,,Thinner para Poliuretano y Poliéster Ref.,exterior,impermeable,,,,,Contiene instrucciones de dilución en la página pública,galón,THINER PARA POLIURETANOS,51008369,86.25,db:vw_inventario_agente,THINER PARA POLIURETANOS,cuarentena,La página pública tiene poca densidad técnica; revisar manualmente
Ajustador Varsol 21132,https://www.pintuco.com.co/productos/ajustador-alifatico-ref-21132/,https://www.pintuco.com.co/download/51234/?tmstv=1672344801,https://tienda.pintuco.com/,,Ajustador alifático varsol 21132 solvente alifático tipo Varsol.,,Ajustador alifático varsol 21132 solvente alifático tipo Varsol.,exterior,,,ajustador,,,,1/4 galón | galón | 5 galones,PQ AJUSTADOR VARSOL 21132 0.95L,5891367,95.0,db:vw_inventario_agente,AJUSTADOR VARSOL,cuarentena,La página pública tiene poca densidad técnica; revisar manualmente
Recubrimiento electrostático Poliéster Antibacterial,https://www.pintuco.com.co/productos/pintura-electrostatica-poliester-antibacterial/,https://www.pintuco.com.co/download/49794/?tmstv=1672344800,https://tienda.pintuco.com/,,Pintura en polvo Poliéster Antibacterial es un recubrimiento en polvo formulado a base de resina Poliéster.,,Pintura en polvo Poliéster Antibacterial es un recubrimiento en polvo formulado a base de resina Poliéster.,exterior,antibacterial | alto_cubrimiento,,,,,,,POLIESTER AZUL CRYSTAL CAJA 20 KG,10375417,85.5,db:vw_inventario_agente,POLIESTER AZUL CRYSTAL CAJA,cuarentena,Falta señal de familia/marca suficientemente fuerte
Thinner para limpieza de equipos 21218,https://www.pintuco.com.co/productos/ajustador-para-limpieza-de-equipos-ref-21218/,https://www.pintuco.com.co/download/51354/?tmstv=1672344803,https://tienda.pintuco.com/,,"Thinner para limpieza de equipos 21218 es una mezcla balanceada de solventes aromático, alifático y oxigenados.",,"Thinner para limpieza de equipos 21218 es una mezcla balanceada de solventes aromático, alifático y oxigenados.",exterior,,,,,,,galón,THINNER LIMPIEZA DE EQUIPOS 21218 5G,10015605,90.87,db:vw_inventario_agente,THINNER LIMPIEZA DE EQUIPOS,cuarentena,Falta señal de familia/marca suficientemente fuerte
Ajustador xilol Ref.21204,https://www.pintuco.com.co/productos/ajustador-xilol-ref-21204/,https://www.pintuco.com.co/download/51238/?tmstv=1672344801,https://tienda.pintuco.com/,,Ajustador Xilol Ref.21204 es un solvente aromático tipo Xilol.,,Ajustador Xilol Ref.21204 es un solvente aromático tipo Xilol.,exterior,,,ajustador,,,,1/4 galón | galón | 5 galones,AJUSTADOR XILOL 21204 GTA007/20L/AA7,5891066,91.3,backend_lookup,AJUSTADOR XILOL,cuarentena,La página pública tiene poca densidad técnica; revisar manualmente
Thinner para Nitro Ref. 21214,https://www.pintuco.com.co/productos/thinner-para-nitro-ref-21214/,https://www.pintuco.com.co/wp-content/uploads/2019/12/ft-thinner-para-nitro-21214-1.pdf,https://tienda.pintuco.com/,,Thinner para Nitro Ref.,,Thinner para Nitro Ref.,exterior,,,,,,Contiene instrucciones de dilución en la página pública,5 galones,THINNER 1/2 BOTELLA,50000934,85.5,db:vw_inventario_agente,THINNER BOTELLA,cuarentena,La página pública tiene poca densidad técnica; revisar manualmente
Ajustador para Epóxicas 21209,https://www.pintuco.com.co/productos/ajustador-para-epoxicas-ref-21209/,https://www.pintuco.com.co/download/51231/?tmstv=1672344801,https://tienda.pintuco.com/,,"Ajustador para Epóxicas Ref.21209 es una mezcla balanceada de solventes aromáticos, ésteres y alcoholes.",,"Ajustador para Epóxicas Ref.21209 es una mezcla balanceada de solventes aromáticos, ésteres y alcoholes.",exterior,,,ajustador,,,,galón | 5 galones,AJUSTADOR UNIVERSAL,56254279,85.5,db:vw_inventario_agente,AJUSTADOR UNIVERSAL,cuarentena,Falta señal de familia/marca suficientemente fuerte
Recubrimiento electrostático Epoxi Poliéster,https://www.pintuco.com.co/productos/pintura-electrostatica-epoxi-poliester/,https://www.pintuco.com.co/download/51358/?tmstv=1672344804,https://tienda.pintuco.com/,,"Pintura en polvo Epoxi Poliéster es un recubrimiento formulado en combinación de resina epóxica y poliéster, denominados HIBRIDOS.",,"Pintura en polvo Epoxi Poliéster es un recubrimiento formulado en combinación de resina epóxica y poliéster, denominados HIBRIDOS.",,alto_cubrimiento,,,,,,,POLIESTER COMBINADO 1/4,56254222,85.5,db:vw_inventario_agente,POLIESTER COMBINADO,cuarentena,Falta señal de familia/marca suficientemente fuerte
Recubrimiento electrostático Poliéster Qualicoat,https://www.pintuco.com.co/productos/pintura-electrostatica-poliester-qualicoat/,https://www.pintuco.com.co/download/51360/?tmstv=1672344804,https://tienda.pintuco.com/,,Pintura en polvo Poliéster Qualicoat es un recubrimiento en polvo formulado a base de resina Poliéster.,,Pintura en polvo Poliéster Qualicoat es un recubrimiento en polvo formulado a base de resina Poliéster.,exterior,alto_cubrimiento,,,,,,,POLIESTER COMBINADO 1/4,56254222,85.5,db:vw_inventario_agente,POLIESTER COMBINADO,cuarentena,Falta señal de familia/marca suficientemente fuerte
Recubrimiento electrostático Poliéster,https://www.pintuco.com.co/productos/pintura-electrostatica-poliester/,https://www.pintuco.com.co/download/49796/?tmstv=1672344800,https://tienda.pintuco.com/,,Pintura en polvo Poliéster es un recubrimiento formulado a base de resina Poliéster.,,Pintura en polvo Poliéster es un recubrimiento formulado a base de resina Poliéster.,exterior,alto_cubrimiento,,,,,,,POLIESTER COMBINADO 1/4,56254222,85.5,db:vw_inventario_agente,POLIESTER COMBINADO,cuarentena,Falta señal de familia/marca suficientemente fuerte
Acabado texturizado Graniplast Esgrafiado Estándar,https://www.pintuco.com.co/productos/acabado-texturizado-graniplast-esgrafiado-estandar/,https://www.pintuco.com.co/download/64536/?tmstv=1672344834,https://tienda.pintuco.com/,https://pintuco.com.co/calculadora-de-pintura/?section=texturas&&name_product=Acabado texturizado Graniplast Esgrafiado Estándar,"Graniplast Estándar Esgrafiado Graniplast Estándar Esgrafiado es un revestimiento plástico de acabado texturizado tipo rayado, elaborado con granos de cuarzo de tamaño controlado, resistente a la intemperie y con buena estabilidad del color, ofreciendo una durabilidad de hasta 3 años en exterior siempre y cuando se sig",,"Graniplast Estándar Esgrafiado Graniplast Estándar Esgrafiado es un revestimiento plástico de acabado texturizado tipo rayado, elaborado con granos de cuarzo de tamaño controlado, resistente a la intemperie y con buena estabilidad del color, ofreciendo una durabilidad de hasta 3 años en exterior siempre y cuando se sig",exterior,durabilidad,,,,,,cuñete,GRANIPLAST ESGRAFIADO ESTANDAR CAN 30 KG,10359447,85.71,backend_lookup,GRANIPLAST ESGRAFIADO ESTANDAR CAN,cuarentena,Falta señal de familia/marca suficientemente fuerte
Acrolatex 50,https://www.pintuco.com.co/productos/acrolatex-50/,https://www.pintuco.com.co/download/64579/?tmstv=1672344835,https://tienda.pintuco.com/,,Acrolatex 50 es un ligante de alta calidad con excelente resistencia al agua y a la intemperie.,,Acrolatex 50 es un ligante de alta calidad con excelente resistencia al agua y a la intemperie.,exterior,,,,,,,,PQ ACROLATEX 50 3508 4K,5891003,90.0,db:vw_inventario_agente,ACROLATEX 3508 4K,cuarentena,Falta señal de familia/marca suficientemente fuerte
Textura acrílica Graniplast Premium Graniacryl,https://www.pintuco.com.co/productos/textura-acrilica-graniplast-premium-graniacryl/,https://www.pintuco.com.co/wp-content/uploads/2020/04/graniplast-premium-graniacryl.pdf,https://tienda.pintuco.com/,https://pintuco.com.co/calculadora-de-pintura/?section=texturas&&name_product=Textura acrílica Graniplast Premium Graniacryl,"Graniplast Premium Graniacryl es un revestimiento plástico de acabado texturizado tipo revoque fino coloreado, elaborado con copolímeros 100% acrílicos base agua y granos de mármol aglutinados de tamaño controlado, que forma una barrera impermeable a la lluvia y resistente a los rayos del sol ofreciendo máxima protecci",,"Graniplast Premium Graniacryl es un revestimiento plástico de acabado texturizado tipo revoque fino coloreado, elaborado con copolímeros 100% acrílicos base agua y granos de mármol aglutinados de tamaño controlado, que forma una barrera impermeable a la lluvia y resistente a los rayos del sol ofreciendo máxima protecci",mamposteria | exterior,impermeable | durabilidad,,,,,"100% acrílicos base agua y granos de mármol aglutinados de tamaño controlado, que forma una barrera impermeable a la lluvia y resistente a los rayos del sol ofreciendo máxima protección, resistencia y durabilidad de hasta 5 años en exterior siempre y cuando se sigan las recomendaciones de preparación de superficie y aplicación del producto",cuñete,GRANIACRYL D TAMBOR 300 KILOS,10128819,85.5,db:vw_inventario_agente,GRANIACRYL D TAMBOR 300 KILOS,cuarentena,Falta señal de familia/marca suficientemente fuerte
Sellador acrílico Sellomax Antialcalino,https://www.pintuco.com.co/productos/sellador-acrilico-sellomax/,https://www.pintuco.com.co/download/64406/?tmstv=1672344833,https://tienda.pintuco.com/,https://pintuco.com.co/calculadora-de-pintura/?section=pinturas-profesionales&&name_product=Sellador acrílico Sellomax Antialcalino,"Sellomax es un recubrimiento acrílico base solvente con nanotecnología de alta penetración en el sustrato y excelente resistencia a intemperie, ataque de álcalis y humedad en superficies verticales.",,"Sellomax es un recubrimiento acrílico base solvente con nanotecnología de alta penetración en el sustrato y excelente resistencia a intemperie, ataque de álcalis y humedad en superficies verticales.",exterior,impermeable | alto_cubrimiento,,sellomax,,,,galón | 5 galones,SELLADOR MADERA POR 1/4,56253609,85.5,db:vw_inventario_agente,SELLADOR MADERA POR,cuarentena,"Tiene valor, pero requiere revisión humana antes de enriquecer el RAG"
Construcleaner Rinse Ladrillo Rojo,https://www.pintuco.com.co/productos/construcleaner-rinse-ladrillo-rojo/,https://www.pintuco.com.co/download/64413/?tmstv=1672344833,https://tienda.pintuco.com/,,"Construcleaner Limpiador Rinse Ladrillo Rojo es un limpiador formulado con una mezcla de ácidos inorgánicos y aditivos especiales, para lavar y desmanchar fachadas en ladrillo rojo.",,"Construcleaner Limpiador Rinse Ladrillo Rojo es un limpiador formulado con una mezcla de ácidos inorgánicos y aditivos especiales, para lavar y desmanchar fachadas en ladrillo rojo.",mamposteria | exterior,,,,,,,,CONSTRUCLEANER RINSE LADRILLO ROJ 52.83G,10347881,89.19,db:vw_inventario_agente,CONSTRUCLEANER RINSE LADRILLO ROJ .,cuarentena,Falta señal de familia/marca suficientemente fuerte
Hidrófugo impermeabilizante Siliconite 10 Transparente,https://www.pintuco.com.co/productos/hidrofugo-impermeabilizante-siliconite-10-transparente/,https://www.pintuco.com.co/download/64354/?tmstv=1672344833,https://tienda.pintuco.com/,,"Siliconite Transparente 10 es un hidrófugo, repelente al agua, con base en siliconas que impermeabiliza y protege las fachadas en ladrillo de los efectos del agua lluvia.",,"Siliconite Transparente 10 es un hidrófugo, repelente al agua, con base en siliconas que impermeabiliza y protege las fachadas en ladrillo de los efectos del agua lluvia.",mamposteria | exterior,impermeable,,,,,,5 galones,SILICONITE W INCOLORO 3009 1/4G,10286737,85.5,db:vw_inventario_agente,SILICONITE W,cuarentena,"Tiene valor, pero requiere revisión humana antes de enriquecer el RAG"
Hidrófugo impermeabilizante Siliconite 7 Transparente,https://www.pintuco.com.co/productos/hidrofugo-impermeabilizante-siliconite-7-transparente/,https://www.pintuco.com.co/download/64348/?tmstv=1672344833,https://tienda.pintuco.com/,,"Siliconite Transparente 7 es un hidrófugo, repelente al agua, con base en siliconas que impermeabiliza y protege las fachadas en ladrillo de los efectos del agua lluvia.",,"Siliconite Transparente 7 es un hidrófugo, repelente al agua, con base en siliconas que impermeabiliza y protege las fachadas en ladrillo de los efectos del agua lluvia.",mamposteria | exterior,impermeable,,,,,,1/4 galón | galón | 5 galones,GUARDA ESCOBA LISO 7 CM REF 206,56253304,85.5,db:vw_inventario_agente,GUARDA ESCOBA LISO CM REF,cuarentena,"Tiene valor, pero requiere revisión humana antes de enriquecer el RAG"
Hidrófugo Siliconite 7W Transparente,https://www.pintuco.com.co/productos/hidrofugo-siliconite-7w-transparente/,https://www.pintuco.com.co/download/64351/?tmstv=1672344833,https://tienda.pintuco.com/,,Siliconite Transparente 7W es un hidrófugo base agua que impermeabiliza y protege las fachadas en ladrillo de los efectos del agua lluvia.,,Siliconite Transparente 7W es un hidrófugo base agua que impermeabiliza y protege las fachadas en ladrillo de los efectos del agua lluvia.,mamposteria | exterior,impermeable | durabilidad,,,,,,5 galones,SILICONITE CONCRETO 5G,10115043,85.5,db:vw_inventario_agente,SILICONITE CONCRETO,cuarentena,"Tiene valor, pero requiere revisión humana antes de enriquecer el RAG"
Hidrófugo Siliconite 12 Ultra,https://www.pintuco.com.co/productos/hidrofugo-siliconite-ultra/,https://www.pintuco.com.co/download/49271/?tmstv=1726499613,https://tienda.pintuco.com/,,"Siliconite Ultra es un hidrófugo de bajo olor, repelente al agua, con base en siliconas con alto poder de penetración, que impermeabiliza y protege las fachadas de los efectos del agua lluvia.",,"Siliconite Ultra es un hidrófugo de bajo olor, repelente al agua, con base en siliconas con alto poder de penetración, que impermeabiliza y protege las fachadas de los efectos del agua lluvia.",mamposteria | exterior,impermeable | durabilidad,,,,,,5 galones,PINCEL NO. 12,56254606,85.5,db:vw_inventario_agente,PINCEL NO.,cuarentena,"Tiene valor, pero requiere revisión humana antes de enriquecer el RAG"
Tela de Refuerzo para Impermeabilización,https://www.pintuco.com.co/productos/tela-de-refuerzo-para-impermeabilizacion/,https://www.pintuco.com.co/download/64389/?tmstv=1672344833,https://tienda.pintuco.com/,,"Tela poliéster para refuerzo de impermeabilizaciones acrílicas y asfálticas en terrazas y cubiertas, fabricada a base de fibras sintéticas de alta compatibilidad con impermeabilizantes acrílicos y asfálticos de aplicación en frio, que les confieren a las impermeabilizaciones una mayor resistencia a la tensión y al rasg",,"Tela poliéster para refuerzo de impermeabilizaciones acrílicas y asfálticas en terrazas y cubiertas, fabricada a base de fibras sintéticas de alta compatibilidad con impermeabilizantes acrílicos y asfálticos de aplicación en frio, que les confieren a las impermeabilizaciones una mayor resistencia a la tensión y al rasg",,impermeable,,,,,,,TELA REFUERZO IMPERMEABILIZACION 50 M,F51060093,88.12,db:vw_inventario_agente,TELA REFUERZO IMPERMEABILIZACION M,cuarentena,Falta señal de familia/marca suficientemente fuerte
Impermeabilizante acrílico Pintuco Fill 12,https://www.pintuco.com.co/productos/impermeabilizante-acrilico-pintuco-fill-12/,https://www.pintuco.com.co/download/64384/?tmstv=1696260219,https://tienda.pintuco.com/,,"Pintuco Fill 12 es un recubrimiento acrílico impermeable y flexible con fibras, para evitar el paso de humedad y filtraciones en cubiertas y terrazas.",,"Pintuco Fill 12 es un recubrimiento acrílico impermeable y flexible con fibras, para evitar el paso de humedad y filtraciones en cubiertas y terrazas.",,impermeable | alto_cubrimiento | durabilidad,,,,,,,PINT FILL 5 GRIS 2753 1/4,10342080,85.5,db:vw_inventario_agente,PINT FILL,cuarentena,Falta señal de familia/marca suficientemente fuerte
Pintura para canchas deportivas y Pisos,https://www.pintuco.com.co/productos/pintura-para-canchas-y-pisos/,https://www.pintuco.com.co/download/64469/?tmstv=1672344834,https://tienda.pintuco.com/,https://pintuco.com.co/calculadora-de-pintura/?section=pinturas-profesionales&&name_product=Pintura para canchas deportivas y Pisos,"Pintura para Canchas y Pisos es un recubrimiento acrílico base agua para demarcación, decoración y protección de diferentes escenarios deportivos.",,"Pintura para Canchas y Pisos es un recubrimiento acrílico base agua para demarcación, decoración y protección de diferentes escenarios deportivos.",piso,alto_cubrimiento,,,,,,galón | 5 galones,"DISCO PARA CONCRETO 7""",56254161,85.5,db:vw_inventario_agente,"DISCO PARA CONCRETO """,cuarentena,Falta señal de familia/marca suficientemente fuerte
Impermeabilizante acrílico Pintuco Fill 7 Antihongos,https://www.pintuco.com.co/productos/impermeabilizante-acrilico-pintuco-fill-7-antihongos/,https://www.pintuco.com.co/download/64381/?tmstv=1696260021,https://tienda.pintuco.com/,,"Pintuco Fill 7 es un recubrimiento acrílico impermeable y flexible con fibras, para evitar el paso de humedad y filtraciones en cubiertas y terrazas.",,"Pintuco Fill 7 es un recubrimiento acrílico impermeable y flexible con fibras, para evitar el paso de humedad y filtraciones en cubiertas y terrazas.",,impermeable | alto_cubrimiento | durabilidad,,,,,,1/4 galón | galón | 5 galones,RANDOGRIP PRIMER ACRILICO CLEAR 5G,10361029,85.5,db:vw_inventario_agente,RANDOGRIP PRIMER ACRILICO CLEAR,cuarentena,Falta señal de familia/marca suficientemente fuerte
