product_name,page_url,technical_sheet_url,buy_url,calculator_url,summary_public,finish,recommended_use,surface_targets,benefit_tags,application_methods,related_products,coverage_ranges,drying_times,dilution_hints,presentations,inventory_match_name,inventory_match_ref,inventory_match_score,inventory_match_source,canonical_family_from_inventory
Repuesto intercambiable,https://www.pintuco.com.co/productos/repuesto-intercambiable-profesional-para-pintura-epoxica/,,https://tienda.pintuco.com/,,,,,,,,,,,,,CUCHILLA REPUESTO BISTURI JUEGO 10 PZS 1,51001612,85.5,db:vw_inventario_agente,CUCHILLA REPUESTO BISTURI JUEGO PZS
Repuesto intercambiable,https://www.pintuco.com.co/productos/repuesto-intercambiable-profesional-para-texturas/,,https://tienda.pintuco.com/,,,,,,,,,,,,,CUCHILLA REPUESTO BISTURI JUEGO 10 PZS 1,51001612,85.5,db:vw_inventario_agente,CUCHILLA REPUESTO BISTURI JUEGO PZS
Pintura Pintulux Anticorrosivo Eco,https://www.pintuco.com.co/productos/pintura-pintulux-anticorrosivo-eco/,https://www.pintuco.com.co/download/48971/?tmstv=1672344797,https://tienda.pintuco.com/,,"Pintulux Anticorrosivo Eco es una pintura anticorrosiva ecológica, 100% acrílica diluible con agua y de acabado mate.",,"Pintulux Anticorrosivo Eco es una pintura anticorrosiva ecológica, 100% acrílica diluible con agua y de acabado mate.",metal | interior | exterior,anticorrosivo | rapido_secado | durabilidad,,pintulux,,,100% acrílica diluible con agua y de acabado mate,1/4 galón | galón,BISTURI ECO,56253573,85.5,db:vw_inventario_agente,BISTURI ECO
Esmalte Pintulux,https://www.pintuco.com.co/productos/esmalte-pintulux/,https://www.pintuco.com.co/download/48965/?tmstv=1672344797,https://tienda.pintuco.com/,https://pintuco.com.co/calculadora-de-pintura/?section=vinilos-decorativos&&name_product=Esmalte Pintulux,"Pintulux Maxima protección es un esmalte alquídico diseñado para interiores y exteriores de excelente adherencia, durabilidad prolongada y máxima resistencia a la Intemperie con un alto cubrimiento y buen rendimiento.",,"Pintulux Maxima protección es un esmalte alquídico diseñado para interiores y exteriores de excelente adherencia, durabilidad prolongada y máxima resistencia a la Intemperie con un alto cubrimiento y buen rendimiento.",interior | exterior,alto_cubrimiento | durabilidad,,pintulux,,,,1/4 galón | galón | 5 galones,ESMALTE PINTULUX ROJO 29 1/8G,10017724,90.0,db:vw_inventario_agente,ESMALTE PINTULUX
Wood Stain / Impregnante para maderas,https://www.pintuco.com.co/productos/wood-stain-impregnante-para-maderas/,https://www.pintuco.com.co/download/48760/?tmstv=1672344796,https://tienda.pintuco.com/,,"Wood Stain es un impregnante para presellar y colorear muebles y artículos en madera sólida, chapillas, tableros aglomerados (partícula-fibra) y/o tableros contrachapados con el fin de darle uniformidad al color e imitar otros tipos de maderas.",Semi mate,"Wood Stain es un impregnante para presellar y colorear muebles y artículos en madera sólida, chapillas, tableros aglomerados (partícula-fibra) y/o tableros contrachapados con el fin de darle uniformidad al color e imitar otros tipos de maderas.",madera | exterior,,,,,,,galón,"DISCO PARA CONCRETO 7""",56254161,85.5,db:vw_inventario_agente,"DISCO PARA CONCRETO """
Rodillo profesional,https://www.pintuco.com.co/productos/rodillo-profesional/,,https://tienda.pintuco.com/,,,,,,,,,,,,,RODILLO ESPUMA PROFESIONAL 9,51000921,95.0,db:vw_inventario_agente,RODILLO ESPUMA PROFESIONAL
Poliuretano Mega,https://www.pintuco.com.co/productos/poliuretano-mega/,https://www.pintuco.com.co/wp-content/uploads/2019/12/ft-sistema-mega-poliuretano-1.pdf,https://tienda.pintuco.com/,,"Poliuretano Mega (PU brillante MG6004/MG6005) productos poliuretanos de dos (2) componentes, de secado al aire con acabado brillante, buena durabilidad y resistencia química.",,"Poliuretano Mega (PU brillante MG6004/MG6005) productos poliuretanos de dos (2) componentes, de secado al aire con acabado brillante, buena durabilidad y resistencia química.",,rapido_secado | durabilidad,,,,,,,MEGA POLIURETANO NEGRO 605 GAL,F51060585,100.0,backend_lookup,MEGA POLIURETANO NEGRO 605 GAL
Plastiprotector uso ligero,https://www.pintuco.com.co/productos/plastiprotector-uso-ligero/,,https://tienda.pintuco.com/,,,,,,,,,,,,,TOOLS PLASTIPROTECTOR USO LIGERO,6447602,95.0,db:vw_inventario_agente,TOOLS PLASTIPROTECTOR USO LIGERO
Altas Temperaturas 905,https://www.pintuco.com.co/productos/corrotec-altas-temperaturas-905-232c-590c/,https://www.pintuco.com.co/wp-content/uploads/2019/12/FT-ALTAS-TEMPERATURAS-905.pdf,https://tienda.pintuco.com/,,"Pintura altas temperaturas 905 (232°c-590°c) es una pintura a base de silicona y grafito, de excelente adherencia, flexibilidad y resistencia a temperaturas hasta 590°C máximo, en seco, en ambientes interiores y exteriores.",,"Pintura altas temperaturas 905 (232°c-590°c) es una pintura a base de silicona y grafito, de excelente adherencia, flexibilidad y resistencia a temperaturas hasta 590°C máximo, en seco, en ambientes interiores y exteriores.",interior | exterior,,,,,,,galon,ALTAS TEMPERATURAS 905 UEA900/3.7L/AA7,5890599,90.0,db:vw_inventario_agente,ALTAS TEMPERATURAS
Altas Temperaturas 902,https://www.pintuco.com.co/productos/corrotec-altas-temperaturas-902-150c-400c/,https://www.pintuco.com.co/wp-content/uploads/2019/12/FT-ALTAS-TEMPERATURAS-902.pdf,https://tienda.pintuco.com/,,"Pintura altas temperaturas 902 (150°c-400°c) es una pintura a base de silicona y grafito, de excelente adherencia, flexibilidad y resistencia a temperaturas hasta 400°C en seco.",,"Pintura altas temperaturas 902 (150°c-400°c) es una pintura a base de silicona y grafito, de excelente adherencia, flexibilidad y resistencia a temperaturas hasta 400°C en seco.",,,,,,,,galon,ALTAS TEMPERATURAS 902 UEA800/3.7L/AA7,5890597,90.0,db:vw_inventario_agente,ALTAS TEMPERATURAS
Pala madera estándar,https://www.pintuco.com.co/productos/pala-madera-estandar/,,https://tienda.pintuco.com/,,,,,,,,,,,,,MH TINTES PARA MADERA AMARILL 7420 0.95L,5891261,85.5,db:vw_inventario_agente,MH TINTES PARA MADERA AMARILL
Mascarilla económica,https://www.pintuco.com.co/productos/mascarilla-economica/,,https://tienda.pintuco.com/,,,,,,,,,,,,,MASCARILLA ECONOMICA,6447600,100.0,db:vw_inventario_agente,MASCARILLA ECONOMICA
Madetec aqua eco P-100,https://www.pintuco.com.co/productos/madetec-aqua-p-100/,https://www.pintuco.com.co/download/63040/?tmstv=1672344832,https://tienda.pintuco.com/,,"Madetec Aqua es un producto base agua de rápido secado, es 2 en 1, porque sella y da acabado.",,"Madetec Aqua es un producto base agua de rápido secado, es 2 en 1, porque sella y da acabado.",madera | interior | exterior,impermeable | rapido_secado | durabilidad,,,,,,1/4 galón | galón | 5 galones,MADETEC BO 2K SELLA ALTA TRANS 28119 50G,10388059,85.5,db:vw_inventario_agente,MADETEC BO 2K SELLA ALTA TRANS
Lentes de seguridad,https://www.pintuco.com.co/productos/lentes-de-seguridad/,,https://tienda.pintuco.com/,,,,,,,,,,,,,PINTUCO TOOLS LENTES DE SEGURIDAD,6447601,90.0,db:vw_inventario_agente,PINTUCO TOOLS LENTES DE SEGURIDAD
Koverlac Primer 1K,https://www.pintuco.com.co/productos/koverlac-primer-1k/,https://www.pintuco.com.co/wp-content/uploads/2019/12/ft-koverlac-primer-1k.pdf,https://tienda.pintuco.com/,,"Koverlac Primer 1K primer nitro de secado al aire, que se caracteriza por su rápido secado, adherencia y uniformidad.",,"Koverlac Primer 1K primer nitro de secado al aire, que se caracteriza por su rápido secado, adherencia y uniformidad.",,rapido_secado,,,,,,,KIT CEILCOTE 680 PRIMER COMPOSITE 4G,10353183,85.5,db:vw_inventario_agente,KIT CEILCOTE 680 PRIMER COMPOSITE
Koverlac Masilla 1K 244/185,https://www.pintuco.com.co/productos/koverlac-masilla-1k/,https://www.pintuco.com.co/wp-content/uploads/2019/12/ft-masilla-koverlac1k-244-185.pdf,https://tienda.pintuco.com/,,Koverlac Masilla 1K es una masilla monocomponente tipo nitrocelulósico.,,Koverlac Masilla 1K es una masilla monocomponente tipo nitrocelulósico.,madera,,,,,,,1/4 galón | galón,MASILLA BOLSA,56254852,85.5,db:vw_inventario_agente,MASILLA BOLSA
Kit 3 pack brocha profesional,https://www.pintuco.com.co/productos/kit-3-pack-brocha-profesional/,,https://tienda.pintuco.com/,,,,,,,,,,,,,BROCHA PROFESIONAL 3,51005334,95.0,db:vw_inventario_agente,BROCHA PROFESIONAL
Indicador de temperatura verde 13306,https://www.pintuco.com.co/productos/indicador-de-temperatura-verde-13306/,https://www.pintuco.com.co/wp-content/uploads/2019/12/ft-indicador-temperatura-verde-13306.pdf,https://tienda.pintuco.com/,,Indicador de temperatura verde 13306 es una pintura formulada con resina silicona y pigmentos especiales que cambian irreversiblemente de color.,,Indicador de temperatura verde 13306 es una pintura formulada con resina silicona y pigmentos especiales que cambian irreversiblemente de color.,metal,,,,,,,galon,AUXILIO DE TRANSPORTE,52052701,85.5,db:vw_inventario_agente,AUXILIO DE TRANSPORTE
Graniplast Silcoplast Interior,https://www.pintuco.com.co/productos/graniplast-silcoplast-interior/,https://www.pintuco.com.co/download/64561/?tmstv=1672344835,https://tienda.pintuco.com/,https://pintuco.com.co/calculadora-de-pintura/?section=texturas&&name_product=Graniplast Silcoplast Interior,"Graniplast Silcoplast Interior es un revestimiento plástico de acabado texturizado, elaborado con copolímeros acrílicos base agua y granos de cuarzo de tamaño controlado, que provee diferentes tipos de acabados según la experticia del aplicador, es ideal para interiores ya que este producto nivela, protege y decora.",,"Graniplast Silcoplast Interior es un revestimiento plástico de acabado texturizado, elaborado con copolímeros acrílicos base agua y granos de cuarzo de tamaño controlado, que provee diferentes tipos de acabados según la experticia del aplicador, es ideal para interiores ya que este producto nivela, protege y decora.",interior,,,,,,,cuñete,PQ SILCOPLAST INT BLANCO 15.52L 30K,5892408,68.09,backend_lookup,SILCOPLAST INT BLANCO 30K
Disolvente Montana,https://www.pintuco.com.co/productos/disolvente-montana/,https://www.pintuco.com.co/download/48725/?tmstv=1672344796,https://tienda.pintuco.com/,,Disolvente en Aerosol para limpiar manchas frescas de pintura en aerosol sobre superficies no porosas.,,Disolvente en Aerosol para limpiar manchas frescas de pintura en aerosol sobre superficies no porosas.,exterior,impermeable,,,,,,,ZP MONTANA 94 MAT GRIS T EX0140307M 0.4L,5893505,85.5,db:vw_inventario_agente,ZP MONTANA MATE GRIS T EX0140307M
Componente A Madetec Pisos Tráfico Alto,https://www.pintuco.com.co/productos/componente-a-madetec-pisos-trafico-alto/,https://www.pintuco.com.co/download/48753/?tmstv=1672344796,https://tienda.pintuco.com/,,"Madetec Pisos Tráfico Alto tiene alta resistencia al rayado y al contacto accidental con agua, productos químicos, licores y alimentos.",,"Madetec Pisos Tráfico Alto tiene alta resistencia al rayado y al contacto accidental con agua, productos químicos, licores y alimentos.",madera | exterior | piso,impermeable,brocha | rodillo,,,8 días,"brocha o rodillo, empates o piel de naranja. Deja secar entre 6 y 8 horas entre manos (capas). Para obtener óptima adherencia entre capa | Brocha o rodillo *Rendimiento teórico 30 – 40 m2 / galón a 1 mano *El rendimiento práctico puede variar según el tipo de sustrato, el mé",1/4 galón | galón,CPR-2000 COMPONENTE A 1/2G,10338187,85.5,db:vw_inventario_agente,CPR 2000 COMPONENTE A
Cinta azul adhesiva,https://www.pintuco.com.co/productos/cinta-azul-adhesiva/,,https://tienda.pintuco.com/,,,,,,,,,,,,,PQ PINTULUX MP BR AZUL OSC 41 3.79L,5890878,85.5,db:vw_inventario_agente,PINTULUX MP BRILLANTE AZUL OSC
Cepillo alambre,https://www.pintuco.com.co/productos/cepillo-alambre/,,https://tienda.pintuco.com/,,,,,,,,,,,,,CEPILLO DE ALAMBRE,56256580,95.0,db:vw_inventario_agente,CEPILLO DE ALAMBRE
Barniz Madetec Vitriflex Tráfico Residencial,https://www.pintuco.com.co/productos/barniz-madetec-vitriflex-trafico-residencial/,https://www.pintuco.com.co/download/48751/?tmstv=1672344796,https://tienda.pintuco.com/,,"Vitriflex Tráfico Residencial es ideal para uso en escaleras, pasamanos, bares, mesas, muebles y artículos de madera en general.",,"Vitriflex Tráfico Residencial es ideal para uso en escaleras, pasamanos, bares, mesas, muebles y artículos de madera en general.",madera | exterior | piso,impermeable | durabilidad,,,,,,1/4 galón | galón,TRAFICO BLER BLANCO GALON,56256449,85.5,db:vw_inventario_agente,TRAFICO BLER BLANCO GALON
Automotriz endurecedor express E50,https://www.pintuco.com.co/productos/endurecedor-express/,https://www.pintuco.com.co/download/51480/?tmstv=1728395774,https://tienda.pintuco.com/,,Endurecedor Express E50 es un endurecedor diseñado específicamente para el uso en sistema de dos componentes desarrollados para reparación Express y Poliuretanos mate.,,Endurecedor Express E50 es un endurecedor diseñado específicamente para el uso en sistema de dos componentes desarrollados para reparación Express y Poliuretanos mate.,,,,,,,,1/4 galón | galón,CARPINCOL EXPRESS,56255295,85.5,db:vw_inventario_agente,CARPINCOL EXPRESS
Altas Temperaturas 904,https://www.pintuco.com.co/productos/corrotec-altas-temperaturas-904-0c-290c/,https://www.pintuco.com.co/wp-content/uploads/2019/12/FT-ALTAS-TEMPERATURAS-904.pdf,https://tienda.pintuco.com/,,"Altas temperaturas 904 (0°c-290°c) es una pintura alquídica aluminio de excelente adherencia, flexibilidad, durabilidad y resistencia a temperaturas hasta 290°C máximo, en seco, en ambientes interiores.",,"Altas temperaturas 904 (0°c-290°c) es una pintura alquídica aluminio de excelente adherencia, flexibilidad, durabilidad y resistencia a temperaturas hasta 290°C máximo, en seco, en ambientes interiores.",metal | interior,durabilidad,,,,,,galon,ALTAS TEMPERATURAS 904 UEA850/3.7L/AA7,5890598,90.0,db:vw_inventario_agente,ALTAS TEMPERATURAS
Altas Temperaturas 901,https://www.pintuco.com.co/productos/corrotec-altas-temperaturas-901-0c-260c/,https://www.pintuco.com.co/wp-content/uploads/2019/12/FT-ALTAS-TEMPERATURAS-901.pdf,https://tienda.pintuco.com/,,"Altas temperaturas 901 (0°C-260°C) es una pintura a base de resina alquídica y pigmentos especiales para lograr un producto de excelente adherencia, flexibilidad y resistencia a temperaturas hasta 260°C en seco.",,"Altas temperaturas 901 (0°C-260°C) es una pintura a base de resina alquídica y pigmentos especiales para lograr un producto de excelente adherencia, flexibilidad y resistencia a temperaturas hasta 260°C en seco.",,,,,,,,galón,ALTAS TEMPERATURAS 901 UEA750/3.7L/AA7,5890596,90.0,db:vw_inventario_agente,ALTAS TEMPERATURAS
Almohadilla rodante,https://www.pintuco.com.co/productos/almohadilla-rodante/,,https://tienda.pintuco.com/,,,,,,,,,,,,,ALMOHADILLA RODANTE,10375602,100.0,db:vw_inventario_agente,ALMOHADILLA RODANTE
Removedor de pinturas 1020,https://www.pintuco.com.co/productos/removedor-pinturas-1020/,https://www.pintuco.com.co/wp-content/uploads/2019/12/ft-removedor-pintura-1020.pdf,https://tienda.pintuco.com/,,"Removedor de pinturas 1020 es un producto diseñado especialmente para la remoción de todo tipo de pinturas, con materiales especiales que prolongan el ataque al recubrimiento para mayor efectividad.",,"Removedor de pinturas 1020 es un producto diseñado especialmente para la remoción de todo tipo de pinturas, con materiales especiales que prolongan el ataque al recubrimiento para mayor efectividad.",,alto_cubrimiento,,removedor,,,,1/4 galón | galon | galón,MEG REMOVEDOR DE PINTURAS 1020 AC 0.47L,5890544,90.0,db:vw_inventario_agente,MEG REMOVEDOR DE PINTURAS 1020 AC
Anticorrosiva alquídica roja 310,https://www.pintuco.com.co/productos/anticorrosiva-alquidica-310/,https://www.pintuco.com.co/download/51437/?tmstv=1672344806,https://tienda.pintuco.com/,,Anticorrosiva alquídica roja 310 es una pintura anticorrosiva alquídica con óxido de hierro como pigmento inhibidor de la corrosión.,,Anticorrosiva alquídica roja 310 es una pintura anticorrosiva alquídica con óxido de hierro como pigmento inhibidor de la corrosión.,,anticorrosivo,,,,,,1/4 galón | galón,LIJA N° 100 ROJA,51017544,85.5,db:vw_inventario_agente,LIJA N° 100 ROJA
Anticorrosiva Alquídica 507,https://www.pintuco.com.co/productos/anticorrosiva-alquidica-507/,https://www.pintuco.com.co/download/51441/?tmstv=1672344806,https://tienda.pintuco.com/,,"Pinturas anticorrosiva alquídico oleorresinosa, con óxido de zinc como inhibidor de la corrosión.",,"Pinturas anticorrosiva alquídico oleorresinosa, con óxido de zinc como inhibidor de la corrosión.",metal,anticorrosivo,,,,,,1/4 galón | galón,ANTICORROSIVA ALQUIDICA RAPIDO SECADO 5G,10281887,87.4,db:vw_inventario_agente,ANTICORROSIVA ALQUIDICA RAPIDO SECADO
Topcoat 450FD,https://www.pintuco.com.co/productos/topcoat-450-fd/,https://www.pintuco.com.co/wp-content/uploads/2019/12/ft-topcoat-450fd.pdf,https://tienda.pintuco.com/,,"Topcoat 450 FD es un esmalte alquídico mate y semibrillante (según referencia) de secamiento al aire, para ser aplicados directamente al metal adecuadamente preparado.",,"Topcoat 450 FD es un esmalte alquídico mate y semibrillante (según referencia) de secamiento al aire, para ser aplicados directamente al metal adecuadamente preparado.",metal | exterior,anticorrosivo | durabilidad,,,,,,galón | 5 galones,TOPCOAT 450FD UFA656M/20L/AA7,5891840,90.0,db:vw_inventario_agente,TOPCOAT 450FD
Interline 850,https://www.pintuco.com.co/productos/interline-850/,,https://tienda.pintuco.com/,,,,,,,,,,,,,INTERLINE 850/859 TLA856/3.7L/AA7,5863696,90.0,db:vw_inventario_agente,INTERLINE
Epoxy Primer 10050,https://www.pintuco.com.co/productos/corrotec-primer-epoxico-10050-13227/,https://www.pintuco.com.co/wp-content/uploads/2019/12/FT-EPOXY-PRIMER-10050.pdf,https://tienda.pintuco.com/,,"Corrotec primer epóxico 10050/13227 es anticorrosiva epóxica de dos componentes, con óxido de hierro y un endurecedor poliamínico, que al mezclarse en las proporciones apropiadas produce al aplicarla, una capa sólida, dura, resistente a aguas dulces potables o saladas, ácidos débiles, sales álcalis, disolventes alifáti",,"Corrotec primer epóxico 10050/13227 es anticorrosiva epóxica de dos componentes, con óxido de hierro y un endurecedor poliamínico, que al mezclarse en las proporciones apropiadas produce al aplicarla, una capa sólida, dura, resistente a aguas dulces potables o saladas, ácidos débiles, sales álcalis, disolventes alifáti",interior | exterior,anticorrosivo | durabilidad,,corrotec,,,,1/4 galón | galon | galón,EPOXY PRIMER 10050 UEA301/3.7L/AA7,5890548,90.0,db:vw_inventario_agente,EPOXY PRIMER
Masilla poliéster P1500,https://www.pintuco.com.co/productos/masilla-poliester-p1500/,https://www.pintuco.com.co/wp-content/uploads/2019/12/FT-Masilla-poliester-P1500.pdf,https://tienda.pintuco.com/,,"Masilla poliéster P1500 es una masilla dos (2) componentes con buen poder de relleno y fácil lijabilidad, recomendada para rellenar o nivelar hendiduras e imperfecciones.",,"Masilla poliéster P1500 es una masilla dos (2) componentes con buen poder de relleno y fácil lijabilidad, recomendada para rellenar o nivelar hendiduras e imperfecciones.",madera,,,,,,,,MEG MASILLA POLIESTER P1500 AC 0.75KG,5899562,90.0,db:vw_inventario_agente,MEG MASILLA POLIESTER P1500 AC
NM500 Sistema de color,https://www.pintuco.com.co/productos/nm-500-sistema-de-color/,https://www.pintuco.com.co/download/51428/?tmstv=1672344806,https://tienda.pintuco.com/,,NM500 Sistema de color poliéster de altos sólidos con tecnología anti-sedimentación.,,NM500 Sistema de color poliéster de altos sólidos con tecnología anti-sedimentación.,exterior,alto_cubrimiento,,,,,,galón,BANDEJA SUPERMAX NARANJA DE 9PULG,10018301,85.5,db:vw_inventario_agente,BANDEJA SUPERMAX NARANJA DE 9PULG
Primer 2K 9216,https://www.pintuco.com.co/productos/primer-2k-9216/,https://www.pintuco.com.co/download/51362/?tmstv=1672344804,https://tienda.pintuco.com/,,"Primer 2K es una base poliuretano en dos componentes para repintado de vehículos, de excelente poder de relleno, rápido secamiento y lijable en húmedo o en seco.",,"Primer 2K es una base poliuretano en dos componentes para repintado de vehículos, de excelente poder de relleno, rápido secamiento y lijable en húmedo o en seco.",,,,,,,,galón,KIT CEILCOTE 680 PRIMER COMPOSITE 4G,10353183,85.5,db:vw_inventario_agente,KIT CEILCOTE 680 PRIMER COMPOSITE
Primer 1K 5010,https://www.pintuco.com.co/productos/primer-1k-5010/,https://www.pintuco.com.co/download/51364/?tmstv=1672344804,https://tienda.pintuco.com/,,"Primer 1K es un primer monocomponente de secado rápido, relleno medio y buena lijabilidad.",,"Primer 1K es un primer monocomponente de secado rápido, relleno medio y buena lijabilidad.",,rapido_secado,,,,,,galón,KIT CEILCOTE 680 PRIMER COMPOSITE 4G,10353183,85.5,db:vw_inventario_agente,KIT CEILCOTE 680 PRIMER COMPOSITE
Impermeabilizante Permex/Base Agua 13421,https://www.pintuco.com.co/productos/impermeabilizante-permex-base-agua-13421/,https://www.pintuco.com.co/wp-content/uploads/2019/12/ft-Permex-base-agua-13421-1.pdf,https://tienda.pintuco.com/,,"Impermeabilizante Permex/Base Agua 13421 es un recubrimiento impermeabilizante, de textura gruesa y alta cobertura que reduce los efectos de la abrasión y protege de la humedad.",,"Impermeabilizante Permex/Base Agua 13421 es un recubrimiento impermeabilizante, de textura gruesa y alta cobertura que reduce los efectos de la abrasión y protege de la humedad.",,impermeable | alto_cubrimiento,,,,,,1/4 galón | galón,IMPERMEABILIZANTE P7,56253804,87.69,db:vw_inventario_agente,IMPERMEABILIZANTE P7
Barniz Crystal 9400,https://www.pintuco.com.co/productos/barniz-crystal-9400/,https://www.pintuco.com.co/download/51369/?tmstv=1672344804,https://tienda.pintuco.com/,,"Barniz Crystal 9400 es usado como acabado final sobre color en sistemas bicapa de repinte automotriz Pintuco, proporcionando un acabado brillante con muy buena nivelación, que actúa como una capa protectora del sistema ante la degradación ambiental.",,"Barniz Crystal 9400 es usado como acabado final sobre color en sistemas bicapa de repinte automotriz Pintuco, proporcionando un acabado brillante con muy buena nivelación, que actúa como una capa protectora del sistema ante la degradación ambiental.",,,,,,,,,K PROM PG8 LLEV9 1/4 BARNIZ CRYSTAL 9400,10371566,90.0,db:vw_inventario_agente,K PROM PG8 LLEV9 BARNIZ CRYSTAL
Barniz Flash Clear 9410,https://www.pintuco.com.co/productos/barniz-flash-clear-9410/,https://www.pintuco.com.co/download/51367/?tmstv=1672344804,https://tienda.pintuco.com/,,"Barniz Flash Clear 9410 es un barniz de hipercurado con altos sólidos diseñado para reparaciones Express, que presenta una excelente nivelación y retención de brillo.",,"Barniz Flash Clear 9410 es un barniz de hipercurado con altos sólidos diseñado para reparaciones Express, que presenta una excelente nivelación y retención de brillo.",exterior,,,,,,,,F BARNIZ K1 AUT  GL-END E40 1/4 GL THII,F51019803,85.5,db:vw_inventario_agente,F BARNIZ K1 AUT GL END E40 THII
Impermeabilizante Permex Base Solvente 13417,https://www.pintuco.com.co/productos/impermeabilizante-permex-base-solvente-13417/,https://www.pintuco.com.co/wp-content/uploads/2019/12/ft-permex-base-solvente-13417-1.pdf,https://tienda.pintuco.com/,,"Impermeabilizante Permex Base Solvente 13417 es un recubrimiento impermeabilizante, de textura gruesa y alta cobertura que reduce los efectos de la abrasión y protege de la humedad.",,"Impermeabilizante Permex Base Solvente 13417 es un recubrimiento impermeabilizante, de textura gruesa y alta cobertura que reduce los efectos de la abrasión y protege de la humedad.",exterior,impermeable | alto_cubrimiento,,,,,,1/4 galón | galón,IMPERMEABILIZANTE P7,56253804,87.69,db:vw_inventario_agente,IMPERMEABILIZANTE P7
Acabado Uniformador Automotriz,https://www.pintuco.com.co/productos/acabado-uniformador-automotriz/,https://www.pintuco.com.co/download/51379/?tmstv=1672344804,https://tienda.pintuco.com/,,,,,,,,,,,,,SILICONA ACETICA NEGRA AUTOMOTRIZ 50 GR,F51060815,61.82,backend_lookup,SILICONA ACETICA NEGRA AUTOMOTRIZ GR
Pintura Primer Anticorrosivo 513,https://www.pintuco.com.co/productos/pintura-primer-anticorrosivo-513/,https://www.pintuco.com.co/wp-content/uploads/2019/12/ft-primer-anticorrosivo-513.pdf,https://tienda.pintuco.com/,,"Primer Anticorrosivo 513 es un producto de recubrimiento anticorrosivo alquídico, de rápido secado, excelente adherencia con ideal para proteger estructuras metálicas en general, que vayan a estar expuestas a ambientes industriales y marinos de agresividad intermedia.",,"Primer Anticorrosivo 513 es un producto de recubrimiento anticorrosivo alquídico, de rápido secado, excelente adherencia con ideal para proteger estructuras metálicas en general, que vayan a estar expuestas a ambientes industriales y marinos de agresividad intermedia.",metal,anticorrosivo | alto_cubrimiento | rapido_secado,,,,,,1/4 galón | galón,PINTURA VARIOS,56252453,85.5,db:vw_inventario_agente,PINTURA VARIOS
Pintulaca Sistema Nitro de Alto Desempeño/Masilla 1K,https://www.pintuco.com.co/productos/pintulaca-sistema-nitro-de-alto-desempeno-masilla-1k/,,https://tienda.pintuco.com/,,,,,,,,,,,,,AUXILIO DE TRANSPORTE,52052701,85.5,db:vw_inventario_agente,AUXILIO DE TRANSPORTE
Pintulaca Sistema Nitro de Alto Desempeño / Colores Básicos,https://www.pintuco.com.co/productos/pintulaca-sistema-nitro-de-alto-desempeno-colores-basicos/,https://www.pintuco.com.co/download/51385/?tmstv=1672344804,https://tienda.pintuco.com/,,,,,,,,,,,,,AUXILIO DE TRANSPORTE,52052701,85.5,db:vw_inventario_agente,AUXILIO DE TRANSPORTE
